{
  "schema_version": 1,
  "challenge_id": "11111111111111111111111111111111",
  "nonce": "2222222222222222222222222222222222222222222222222222222222222222",
  "purpose": "loop-completion",
  "subject": "33333333333333333333333333333333",
  "payload_kind": "verifier-evidence",
  "binding_sha256": "4444444444444444444444444444444444444444444444444444444444444444",
  "approval_ref": "approval-01",
  "issued_at": "2026-08-22T10:00:00Z",
  "expires_at": "2026-08-22T10:30:00Z"
}
